<?xml version="1.0" encoding="UTF-8"?>
<!--Sample XML file generated by XMLSpy v2010 (http://www.altova.com)-->
<transport:Message StructuresVersion="String" ECLVersion="String" DatatypesVersion="String" TransactionDomain="SCRIPT" TransactionVersion="String" TransportVersion="String" xsi:schemaLocation="http://www.ncpdp.org/schema/Transport transport.xsd" xmlns:transport="http://www.ncpdp.org/schema/Transport" xmlns:datatypes="http://www.ncpdp.org/schema/datatypes" xmlns:SCRIPT="http://www.ncpdp.org/schema/SCRIPT " xmlns:structures="http://www.ncpdp.org/schema/structures" xmlns:xsi="http://www.w3.org/2001/XMLSchema-instance">
	<transport:Header>
		<transport:To Qualifier="P">7701630</transport:To>
		<transport:From Qualifier="M">111111</transport:From>
		<transport:MessageID>66666684</transport:MessageID>
		<transport:RelatesToMessageID>A25</transport:RelatesToMessageID>
		<transport:SentTime>2010-10-01T08:20:26</transport:SentTime>
		<transport:SenderSoftware>
			<transport:SenderSoftwareDeveloper>SWITCH123</transport:SenderSoftwareDeveloper>
			<transport:SenderSoftwareProduct>ROUTEA</transport:SenderSoftwareProduct>
			<transport:SenderSoftwareVersionRelease>55</transport:SenderSoftwareVersionRelease>
		</transport:SenderSoftware>
	</transport:Header>
	<transport:Body>
		<transport:Status>
				<transport:Code>002</transport:Code>
	</transport:Status>
</transport:Body>
</transport:Message>