<?xml version="1.0" encoding="UTF-8"?>
<!--Sample XML file generated by XMLSpy v2012 rel. 2 (x64) (http://www.altova.com)-->
<transport:Message DatatypesVersion="!" TransportVersion="!" TransactionDomain="Specialized" TransactionVersion="!" StructuresVersion="!" ECLVersion="!" xsi:schemaLocation="http://www.ncpdp.org/schema/Transport transport.xsd" xmlns:transport="http://www.ncpdp.org/schema/Transport" xmlns:xsi="http://www.w3.org/2001/XMLSchema-instance">
	<transport:Header>
		<transport:To Qualifier="D">!</transport:To>
		<transport:From Qualifier="C">!</transport:From>
		<transport:MessageID>!</transport:MessageID>
		<transport:RelatesToMessageID>!</transport:RelatesToMessageID>
		<transport:SentTime>2001-12-17T09:30:47Z</transport:SentTime>
		<transport:Security>
			<transport:UsernameToken>
				<transport:Username>!</transport:Username>
				<transport:Password Type="PasswordDigest">String</transport:Password>
				<transport:Nonce>!</transport:Nonce>
				<transport:Created>2001-12-17T09:30:47Z</transport:Created>
			</transport:UsernameToken>
			<transport:Sender>
				<transport:SecondaryIdentification>!</transport:SecondaryIdentification>
				<transport:TertiaryIdentification>!</transport:TertiaryIdentification>
			</transport:Sender>
			<transport:Receiver>
				<transport:SecondaryIdentification>!</transport:SecondaryIdentification>
				<transport:TertiaryIdentification>!</transport:TertiaryIdentification>
			</transport:Receiver>
		</transport:Security>
		<transport:SenderSoftware>
			<transport:SenderSoftwareDeveloper>!</transport:SenderSoftwareDeveloper>
			<transport:SenderSoftwareProduct>!</transport:SenderSoftwareProduct>
			<transport:SenderSoftwareVersionRelease>!</transport:SenderSoftwareVersionRelease>
		</transport:SenderSoftware>
		<transport:Mailbox>
			<transport:MailboxID>!</transport:MailboxID>
			<transport:DeliveredID>!</transport:DeliveredID>
			<transport:AdditionalTraceNumber>!</transport:AdditionalTraceNumber>
			<transport:AcknowledgementID>!</transport:AcknowledgementID>
		</transport:Mailbox>
		<transport:TestMessage>0</transport:TestMessage>
		<transport:RxReferenceNumber>!</transport:RxReferenceNumber>
		<transport:TertiaryIdentifier>!</transport:TertiaryIdentifier>
		<transport:PrescriberOrderNumber>!</transport:PrescriberOrderNumber>
	</transport:Header>
	<transport:Body>
		<transport:Status>
			<transport:Code>001</transport:Code>
			<transport:DescriptionCode>008</transport:DescriptionCode>
			<transport:Description>\!</transport:Description>
			<transport:PrescriptionDeliveryMethod>2</transport:PrescriptionDeliveryMethod>
		</transport:Status>
	</transport:Body>
</transport:Message>
